round,pickRound,pickNumber,PickValue,MlbRank,SigningBonus,MlbID,PlayerFirst,PlayerLast,UseName,MiddleName,BirthDate,PrimaryPosition,HomeCity,HomeState,HomeCountry,BirthCity,BirthState,BirthCountry,SchoolName,SchoolClass,SchoolCountry,SchoolState,Height,Weight,BatSide,PitchSide,DraftedTeam,MlbVideo,MlbBlurb
3,11,89,"$667,900.00",13,$0.00,682929,Matthew,Allan,Matthew,Bruce,2001-04-17,P,SANFORD,Florida,USA,Fullerton,CA,USA,Seminole HS,HS SR,USA,FL,75,225,R,R,New York Mets,https://atmlb.com/2Qjk6Fo,"Not a big name when the summer showcase circuit season began, Allan had put himself firmly on the map with consistently strong performances across multiple events. He's picked up this spring where he left off, continuing his climb up Draft boards to become perhaps the top high school arm in the class. Big, strong and physical, Allan has seen all of his stuff play up during his senior season. His four-seam fastball continues to touch 97 mph on a regular basis and he's maintained that velocity deep into starts, showing that it wasn't just the shorter stints of the showcase circuit that allowed him air it out. He'll drive the ball down in the zone, but can pitch up and down with his fastball well, with improved overall command of the pitch both in and out of the strike zone. He complements the heater with a plus power curve he can throw for strikes, missing bats consistently. His changeup has also taken a step forward, giving him a third at least above-average pitch. While some scouts don't love Allan's arm action in the back, it doesn't affect him out front and he's commanded all three of his pitches extremely well, repeating his delivery consistently. He has frontline starter potential, and that should entice enough teams in the first round to keep Allan from heading to the University of Florida."
3,12,90,"$657,600.00",,$0.00,668715,Spencer,Steer,Spencer,Gordon,1997-12-07,SS,EUGENE,Oregon,USA,Long Beach,CA,USA,Oregon,4YR JR,USA,OR,71,185,R,R,Minnesota Twins,,
3,13,91,"$647,300.00",161,$0.00,687072,Jamari,Baylor,Jamari,Ellis,2000-08-25,SS,GLEN ALLEN,Virginia,USA,Richmond,VA,USA,Benedictine School,HS SR,USA,VA,71,190,R,R,Philadelphia Phillies,https://atmlb.com/2Ez7IML,"Two years ago, Baylor transferred to Benedictine College Preparatory School in the Richmond, Va., area. He was young for his grade, so he re-classified and repeated 11th grade upon reaching the military school. The move seems to have paid off in terms of his baseball tools, as he's moved firmly into Day 2 conversations. Baylor shows flashes of all five tools, though he doesn't always consistently show them all at the same time. He didn't impact the ball that much on the summer showcase circuit, but scouts think his right-handed swing works and there should be average future power. It's a loose athletic swing with some bat speed, giving him the chance to hit, but there's some swing and miss and some work to be done on his approach. An excellent athlete, Baylor runs well and is aggressive on the basepaths. He's raw at shortstop, and he'll need to work on his angles and footwork, but might have the chance to stick there, thanks to decent hands, his athleticism and a strong arm that has been up to 92 mph on the mound. Teams feel that Baylor, committed to Louisburg Junior College, is signable. He had some helium as the Draft approached, with teams pouring in to see him and considering taking him in the top five rounds."
3,14,92,"$637,600.00",75,$0.00,686799,Jack,Kochanowicz,Jack,Von,2000-12-22,P,BALA CYNWYD,Pennsylvania,USA,Philadelphia,PA,USA,Harriton HS,HS SR,USA,PA,78,220,L,R,Los Angeles Angels,https://atmlb.com/30EayJC,"One of the taller and more projectable pitchers in the 2019 high school class, Kochanowicz performed well while hitting most of the major stops on the showcase circuit last summer. Like most prep arms from the Northeast, he's far from a finished project, but his potential is obvious. If he follows through on his commitment to Virginia, he could develop into a first-rounder in the 2022 Draft. Kochanowicz has an 89-93 mph fastball that tops out at 95 with riding life up in the strike zone. His 6-foot-6 frame and high-three-quarters arm slot provide plenty of downhill plane, and his size also creates extension that adds to the quality of his fastball package. He has high spin rates and good depth on his mid-70s curveball, which could be a hammer once he gains more velocity. Kochanowicz has some sink on his changeup and while it's often too firm, it should improve as he throws it more often. Many tall, young pitchers have trouble keeping their deliveries in sync, but he repeats his mechanics well and provides strikes."
3,15,93,"$627,900.00",143,$0.00,663536,Tristin,English,Tristin,Hall,1997-05-14,1B,WILLIAMSON,Georgia,USA,Stockbridge,GA,USA,Georgia Tech,4YR SR,USA,GA,75,208,R,R,Arizona Diamondbacks,https://atmlb.com/2QuwUc0,"Declining to sign with the Indians as a 39th-rounder out of a Georgia high school in 2015, English opted instead to attend Georgia Tech as a two-way player. He earned all-Atlantic Coast Conference honors as a freshman in 2016 but didn't pitch because of bone spurs in his elbow, then missed all of 2017 following an operation to remove the spurs and subsequent Tommy John surgery. He has succeeded at the plate and on the mound the last two years, including a stint in the Cape Cod League, and could go in the top four or five rounds as a redshirt junior position player. English prefers hitting to pitching and has convinced most scouts that he has a brighter future as an everyday player. He has made huge strides this spring with his ability to translate his strength into power production and make consistent contact from the right side of the plate. He could continue to improve further if he focuses solely on hitting and develops more patience. English moves well for a 6-foot-3, 214-pounder and has close to average speed once he gets going. He plays a quality first base and should be able to handle right field, though the Yellow Jackets have taken it easy on him defensively because he doubles as their closer. A pro club could toy with the idea of using him both ways because he has a 92-95 mph fastball and flashes a solid slider."
3,16,94,"$618,200.00",55,$0.00,666141,Andrew,Mendoza,Drew,Keeler,1997-10-10,3B,MINNEOLA,Florida,USA,Ocoee,FL,USA,Florida State,4YR JR,USA,FL,77,225,L,R,Washington Nationals,https://atmlb.com/2Hvgugs,"In 2016, Mendoza was the 36th-best Draft prospect according to MLB Pipeline. He might have gone that high if not for his strong commitment to Florida State, but instead was taken in the 36th round by the Tigers. Three years later, the third baseman is available again with some excellent tools and a mixed resume with the Seminoles. Listed at 6-foot-5, 230 pounds, Mendoza is a physical specimen. The left-handed hitter can really impact the ball with plus raw power and good leverage. He does draw a lot of walks, but there is also a good amount of swing and miss to his game, with some evaluators concerned about his ability to hit at the next level and get to that raw power consistently. His size limits him somewhat at the hot corner, but he does have the hands and arm to potentially stay there, while others think he might need to move to first. Mendoza's junior year has been enigmatic with a bit of a slow motor on the field. The raw power is legitimate, though, and the team that thinks it can get him to tap into it more consistently will take him in the early rounds, with some seeing a three true outcomes hitter like Russell Branyan in him."
3,17,95,"$610,800.00",,$0.00,670208,Matthew,Fraizer,Matt,Teran,1998-01-12,CF,FRESNO,California,USA,Fresno,CA,USA,Arizona,4YR JR,USA,AZ,75,205,L,R,Pittsburgh Pirates,,
3,18,96,"$604,800.00",105,$0.00,666138,Anthony,Locey,Tony,Quinn,1998-07-29,P,COLUMBUS,Georgia,USA,Columbus,GA,USA,Georgia,4YR JR,USA,GA,75,239,R,R,St. Louis Cardinals,https://atmlb.com/2QuuWIE,"Locey teamed with Jake Fromm to help Houston County High (Warner Robins, Ga.) win the Georgia state 5-A baseball championship as a senior in 2016. Both headed to the University of Georgia, where Fromm has starred at quarterback and Locey has been a key starter on a Bulldogs team that won a school-record 21 Southeastern Conference games this season. While there's debate as to whether he winds up as a starter or reliever in the long run, there's no question that he has one of the best arms in college baseball's top conference. Locey operates at 92-95 mph and touches 97 with his fastball, using his high-three-quarters arm slot to create downhill plane. He maintains his velocity throughout his starts and figures to hit 100 mph if he works shorter stints out of the bullpen. His low-80s slider can be sharp and a solid pitch when he commands it, and he also shows promising shape on a curveball that's a work in progress. Mostly about power, Locey hasn't shown much of a changeup. He's strong and physical, though to remain a starter he'll have to do a better job of repeating his delivery and commanding his pitches. If he does become a reliever, he has late-inning potential and perhaps a chance to become a closer."
3,19,97,"$599,100.00",129,$0.00,686651,Levi,Stoudt,Levi,,1997-12-04,P,PENNSBURG,Pennsylvania,USA,Pottstown,PA,USA,Lehigh,4YR JR,USA,PA,73,195,R,R,Seattle Mariners,https://atmlb.com/2I5wyEP,"Only two players have made it to the big leagues from Lehigh University in the Draft era, the most recent being Matt McBride, who was selected by the Indians back in 2006. Stoudt hopes to be the next, though an up-and-down junior season has made it a little tougher to pinpoint when he might get taken. A three-year starter for Lehigh, Stoudt has four pitches that could work for him at the next level. He tends to sit around 92-93 mph and can reach back for a tick or two more at times, though his fastball flattened out a bit this year and was more hittable. His best secondary pitch is his changeup, which he sells well and throws with run and sink at times. At its best, it has downward rotation and fade to it and he can throw it to both sides of the plate. His slider is solid-average and he can land it for strikes, getting swings and misses with it against Patriot League hitters. In the past, his curveball has been a better weapon for him than it has been this year, though he has shown the ability to throw all four offerings for strikes. The main concern about Stoudt is his size. The 6-foot-1 right-hander isn't extremely physical and while he does have some strength in his lower half, he does need to add more strength to offset worries about his durability over the course of a long pro season. A team that believes he can do that will be willing to bank on his stuff and feel for pitching to be a back-end starter in the future."
3,20,98,"$593,100.00",,$0.00,671739,Michael,Harris,Michael,Machion,2001-03-07,P,ELLENWOOD,Georgia,USA,DeKalb,GA,USA,Stockbridge HS,HS SR,USA,GA,72,195,S,L,Atlanta Braves,,"Harris was a two-way player at Stockbridge High School in Georgia, an outfielder and a left-handed pitcher. A switch-hitter at the plate, the 6-foot, 190-pound senior has an interesting swing and can hit for power. Harris also has good speed. On the mound, he sits in the 89-93 mph range with his fastball and throws a pretty good curveball and changeup. He has a good feel for pitching. Harris is a Texas Tech commit for next year."
3,21,99,"$587,400.00",,$0.00,687071,Shane,Sasaki,Shane,Isao,2000-07-01,CF,MILILANI,Hawaii,USA,Honolulu,HI,USA,Iolani HS,HS SR,USA,HI,72,165,R,R,Tampa Bay Rays,https://atmlb.com/2Wf3FQx,
3,22,100,"$581,600.00",116,$0.00,686608,Jacob,Wallace,Jacob,Michael,1998-08-13,P,METHUEN,Massachusetts,USA,Lawrence,MA,USA,Connecticut,4YR JR,USA,CT,73,190,R,R,Colorado Rockies,https://atmlb.com/2WvLxBk,"Wallace has done nothing but relieve in his three years at UConn, and each year he's gotten better while taking on more responsibility. He took a nice step forward as a sophomore setup man, then was absolutely dominant during an All-Star Cape Cod League performance, where he didn't give up a run over 12 appearances. He used that as a springboard to become one of the best college closers in the nation and make a run at the school's single-season saves record. Wallace is the prototypical power short reliever and his stuff will play at the next level. He'll throw both a two-seam and four-seam fastball, the former thrown 92-94 mph with good sink and the latter sitting 95-98 mph consistently. He does have a tendency to rush to the plate, which forces him to get on the side of his slider. Once he learns to stay back consistently and stay on top of the hard breaking ball, it should be a plus out pitch for him. The right-hander has struggled with finding the strike zone in the past, but has lowered his walk rate each year and has been going right after hitters in his junior season. He could be the first pure reliever taken in the Draft and has the chance to pitch late in games in a big league bullpen in the future."
3,23,101,"$577,000.00",141,$0.00,683172,Joseph,Naranjo,Joseph,Elias,2001-05-11,1B,CHINO,California,USA,Whittier,CA,USA,Rueben S. Ayala HS,HS SR,USA,CA,72,180,L,L,Cleveland Indians,https://atmlb.com/2MoWfG2,"Ruben S. Ayala High School in Chino Hills, Calif., has had some pro prospects grace its field, but it's been a while. There have been a pair of second-round picks from the school, including Ryan Mount in 2005, but Mount was actually the last player drafted from the school. Naranjo, perhaps the best bat in the area, should end the dry stretch. While he isn't the biggest or most projectable guy in the world, the six-foot Naranjo can really hit. He's one of the better pure hitters among the high school set in the country and proved that during the summer showcase circuit. The left-handed hitter can hit lefties, should continue to hit for average as perhaps a future plus hitter and should get to at least Major League average power, with over-the-fence pop showing up well during his senior season. He's a bit limited beyond the bat, though he plays above his speed on the basepaths with good instincts and is a solid defender at first. Some think that he could play an outfield corner, with an arm that touches the upper 80s on the mound. To profile at first or right field, there will be more pressure on Naranjo to develop into a true run-producing type of hitter. The Cal State Fullerton commit's offensive potential could get him drafted in the top five or six rounds."
3,24,102,"$571,400.00",72,$0.00,686752,Ryan,Pepiot,Ryan,Michael,1997-08-21,P,CARMEL,Indiana,USA,Indianapolis,IN,USA,Butler,4YR JR,USA,IN,75,215,R,R,Los Angeles Dodgers,https://atmlb.com/2JzgxKw,"Two-time All-Star Pat Neshek is the highest pick ever out of Butler, which has had just two players selected since Neshek went in the sixth round to the Twins 17 years ago. Pepiot will set a new standard this June, expected to go in the first two or three rounds as the best of an unusually strong group of Indiana college pitchers. He has spent his entire career in the Bulldogs' weekend rotation and has gotten better throughout his three years in Indianapolis. Pepiot has one of the best changeups in the college ranks, a low-80s offering with fade that he sells with deceptive arm speed. He can reach 96 mph with some riding action on his fastball, which usually parks around 91-94. Both his curveball and slider can be solid pitches at their best but lack consistency. Pepiot has a strong, durable frame that should allow him to hold up as a starter. His three-quarters delivery features some crossfire that adds deception but somewhat hampers his ability to throw strikes. He has proven to be hard to hit in college but will need to be more precise with his pitches at the next level."
3,25,103,"$565,600.00",174,$0.00,686449,Michael,McAvene,Michael,Earl,1997-08-24,P,CAMBY,Indiana,USA,Indianapolis,IN,USA,Louisville,4YR JR,USA,KY,75,210,R,R,Chicago Cubs,https://atmlb.com/2wruGAW,"The top pitcher in Louisville's 2016 recruiting class, McAvene was carving out a role as a freshman when he blew out his elbow in April. He returned to the mound a year later following Tommy John surgery and has emerged as the Cardinals' closer this spring. He offers additional intrigue because of the college relievers projected to go in the first five or six rounds, he might have the best chance to transition to starting in pro ball. Coming out of the bullpen, McAvene sits at 93-95 mph and can reach 96 with riding life on his four-seam fastball. He's doing a better job of generating velocity without overthrowing this spring, helping his ability to pound the bottom of the strike zone. He backs it up with a low-80s breaking ball that combines slider power with curveball depth. Both of McAvene's pitches grade as plus at their best, and he's throwing more strikes than ever. To succeed in a pro rotation, he'll need to develop a changeup after having little use for one to this point of his career. His strong 6-foot-3 frame is built for durability and his dramatically improved command bodes well for his future."
3,26,104,"$560,000.00",,$0.00,687526,Marcus,Smith,Marcus,Edward,2000-09-11,CF,KANSAS CITY,Kansas,USA,Kansas City,MO,USA,Pembroke Hill HS,HS SR,USA,MO,71,190,L,L,Oakland Athletics,https://atmlb.com/2W9tJYu,
3,27,105,"$554,300.00",107,$0.00,666331,Jacob,Sanford,Jacob,Alexander,1997-10-24,CF,Dartmouth Morris Lake,Nova Scotia,CAN,Dartmouth,NS,Canada,Western Kentucky,4YR JR,USA,KY,74,215,L,R,New York Yankees,https://atmlb.com/2W9ghsg,"Sanford drew no scouting or recruiting interest as a high schooler in Nova Scotia -- his only college offer was to play volleyball at Dalhousie University in his home province -- so he walked on at McCook (Neb.) CC. He hit 23 homers in two years and broke the McCook slugging record twice while using wood bats, then transferred to Western Kentucky for 2019. Still unknown at the start of the season, he has stunned scouts with his power and won the first Conference USA regular-season triple crown by hitting .402/.488/.828 with 22 homers and 65 RBI. Sanford's batting-practice displays are becoming legend and his well above-average raw power ranks among the best in the 2019 Draft. He generates impressive bat speed and packs plenty of strength and leverage in his 6-foot-2, 215-pound frame. There are some concerns about the deep load in his left-handed swing and a tendency to get off balance at times, but the quickness of his stroke and his hand-eye coordination make it work. In addition to his prodigious power, Sanford also offers plus speed and can flash even faster running times, though he's not a prolific basestealer. A first baseman at McCook, he has handled himself well after moving to right field with the Hilltoppers. He has fringy arm strength, so he'll fit better in left field as a pro."
3,28,106,"$549,000.00",108,$0.00,685084,Jordan,Brewer,Jordan,Austin,1997-08-01,CF,SAINT JOSEPH,Michigan,USA,St. Joseph,MI,USA,Michigan,4YR JR,USA,MI,73,195,R,R,Houston Astros,https://atmlb.com/2JK4j1D,"As a high school wide receiver, Brewer drew interest from the likes of Michigan and Wisconsin, but his football hopes evaporated when he dislocated his shoulder as a senior. He slipped through the cracks in baseball recruiting and wound up spending his first two college seasons at Lincoln Trail (Ill.) CC. He has been a revelation after joining the Wolverines as a junior, exciting scouts with his combination of tools and performance. If he realizes his upside, Brewer will have at least solid tools across the board. He has well above-average speed and plus raw power, giving him 20-20 potential. He doesn't try to do too much at the plate, using his combination of a quick right-handed swing and strength to deliver hard contact to all fields. A center fielder at Lincoln Trail, Brewer has played mostly right field and first base this spring because Michigan had greater needs there. He needs to refine his instincts a bit but he has the quickness to become a quality defender in center when he returns there in pro ball. His arm grades as average to solid and plays up because he makes accurate throws."
3,29,107,"$543,500.00",84,$0.00,666171,Ryan,Zeferjahn,Ryan,Joseph,1998-02-28,P,TOPEKA,Kansas,USA,Topeka,KS,USA,Kansas,4YR JR,USA,KS,77,225,R,R,Boston Red Sox,https://atmlb.com/2QgUjNS,"Part of a crazy-deep Kansas high school pitching crop in 2016 -- Riley Pint went fourth overall to the Rockies, Joey Wentz signed for $3.05 million as a supplemental first-rounder, Cole Duensing nearly doubled his slot value in the sixth round -- Zeferjahn could have been a top-three-rounds pick if he hadn't been set on becoming a Jayhawk. Three years later, his scouting reports read pretty much the same and he has the same upside in the Draft. He has a big arm that produces inconsistent results, as evidenced in early April when he gave up nine runs against Texas Tech and then struck out a career-high 14 against Oklahoma State in his next start. Zeferjahn is capable of working with a 93-96 mph fastball as a starter and has climbed as high as 98, though there are games where he'll operate at 90-93. His heater is fairly straight considering he throws from a low-three-quarters slot, an angle that makes it tough for him to stay on top of his slider, which ranges anywhere from 80-87 mph and from a below-average slurve to a plus offering with hard bite. His changeup grades better than his slider at times, though it also lacks consistency. Zeferjahn is athletic but tends to get under his pitches, costing him control and quality. He doesn't have a track record of throwing strikes, leading several scouts to project a move the bullpen, where he could regularly feature a double-plus fastball in shorter stints. He's at his best when he pitches closer to a traditional three-quarters arm angle but has trouble doing so."
4,1,108,"$538,200.00",179,$0.00,687401,Joseph,Ortiz,Joseph,Anthony,1998-07-14,SS,GARDEN GROVE,California,USA,Garden Grove,CA,USA,New Mexico State,4YR JR,USA,NM,71,175,R,R,Baltimore Orioles,https://atmlb.com/2XdcCpN,"A year ago, right-hander Kyle Bradish set a New Mexico State record by being the first player from the program to be drafted in the fourth round. This year, Ortiz is the top Aggies player on Draft boards with the chance to be the first position player from the school to go in the top five rounds since the Nationals took outfielder Daniel Johnson in the fifth back in 2016. Ortiz's best quality is his ability to stay at shortstop long-term. He has really good hands and first-step quickness to go along with enough arm to stick at the premium position. The right-handed hitter has a solid approach at the plate with very good bat-to-ball skills that have allowed him to hit over .400 this spring. He should be able to hit for average at the next level, though the power he has shown is a bit of a hitter-friendly environment and conference mirage. A bit undersized, Ortiz isn't a sexy pick in terms of loud tools. But his high marks for work ethic and leadership skills to go along with his defensive chops and contact skills should give him a shot to go at some point on Day 2 of the Draft."
4,2,109,"$533,000.00",156,$0.00,686681,Michael,Massey,Michael,,1998-03-22,2B,Palos Park,Illinois,USA,Palos Park,IL,USA,University of Illinois,4YR JR,USA,IL,72,190,L,R,Kansas City Royals,https://atmlb.com/2WxyBe0,"Consistency has defined Massey's college career at Illinois. He has posted solid and very similar offensive numbers in each of his three seasons in Champaign, and he went 60 consecutive games and more than a year from 2017-18 without making an error at second base. He spent the first half of 2019 as a DH while battling back problems, then returned to the field and played flawless defense in 23 regular-season contests. Using a compact left-handed swing and a controlled approach, Massey drills line drives from gap to gap. He has exceptional hand-eye coordination and manages the strike zone extremely well, and he continued to provide steady production with wood bats in the Cape Cod League last summer. He doesn't hit for much power, though his ability to barrel the ball could translate into double-digit home run totals at the next level if he gets more aggressive. An average runner, Massey makes little impact on the bases but gobbles up plenty of ground balls on defense. He has great hands and an average arm, and he might be able to handle some shortstop duty in pro ball. While he may not have wow tools or a huge ceiling, he owns a high floor as a reliable college bat who can play up the middle."
4,3,110,"$527,800.00",127,$0.00,686808,James,Beard,James,Tyrone,2000-09-24,CF,BROOKHAVEN,Mississippi,USA,Brookhaven,MS,USA,Loyd Star HS,HS SR,USA,MS,70,170,R,R,Chicago White Sox,https://atmlb.com/2wp9CuT,"Beard is both the fastest player in this year's Draft and a high school outfielder from Mississippi, so he naturally draws Billy Hamilton comparisons. He clocked a 6.21-second 60-yard dash at a Prospect Development Pipeline event last June and wreaked havoc on the bases at the East Coast Pro showcase in August. He has almost no history against quality pitching and faces weak prep competition, so scouts aren't sure what to make of his bat, but he has enough promise that he could go as early as the third round. Unlike Hamilton, Beard shows the potential to make some impact at the plate. He has a quick right-handed swing and strength in his hands, and he flashes the ability to backspin balls. He'll have to prove he can manage the strike zone and handle breaking pitches, but he has the upside of at least an average hitter with double-digit home run power. Beard's quickness allows him to beat out routine grounders, steal bases and cover plenty of ground in center field. The Meridian (Miss.) CC recruit tracks balls well and could become a plus defender if he gets more aggressive. His fringy arm is more than playable in center."
